{
  "tsg_id": "823046",
  "filter": {},
  "time_range": {
    "start": "2025-12-12T00:00:35Z",
    "end": "2024-10-24T21:02:45Z",
    "last": "example-last"
  },
  "count": 100,
  "histogram": {
    "field": "example-field",
    "interval": "15m"
  },
  "group_by": [
    "example-group_by_item",
    "example-group_by_item",
    "example-group_by_item"
  ],
  "sort": [
    {
      "field": "example-field",
      "order": "desc"
    },
    {
      "field": "example-field",
      "order": "desc"
    }
  ]
}
